{
  "learner_id": "learner-001",
  "domain": "",
  "start_level": "unknown",
  "target_outcome": "",
  "application_context": "",
  "time_budget": "",
  "scope": {
    "in_scope": [],
    "out_of_scope": [],
    "assumptions": []
  },
  "completion_criteria": [],
  "capstone": {
    "description": "",
    "evidence_required": [],
    "status": "not_started"
  },
  "finish_behavior": {
    "when_complete": "Summarize mastery evidence, update the journey book, mark the contract complete, and propose next-step options.",
    "next_step_options": []
  },
  "status": "draft",
  "created_at": "2026-01-01T09:00:00Z",
  "updated_at": "2026-01-01T09:00:00Z"
}
